Ich plane, innerhalb von drei Monaten den Kurs erfolgreich abzuschließen.; InformCompletionGoal
Mein Wunsch ist es, in drei Monaten den Kurs abzuschließen.; InformCompletionGoal
Mein Ziel ist es, in drei Monaten erfolgreich den Kurs abzuschließen.; InformCompletionGoal
Ich möchte den Kurs spätestens in drei Monaten abschließen.; InformCompletionGoal
Mein Ziel ist es, in drei Monaten abzuschließen.; InformCompletionGoal
Ich möchte in drei Monaten den Kurs erfolgreich beendet haben.; InformCompletionGoal
Mein Ziel ist es, in drei Monaten den Kurs erfolgreich zu abschließen.; InformCompletionGoal
In drei Monaten will ich den Kurs erfolgreich bestanden haben.; InformCompletionGoal
Innerhalb der nächsten drei Monate möchte ich den Kurs absolvieren.; InformCompletionGoal
In drei Monaten will ich den Kurs erfolgreich absolvieren.; InformCompletionGoal
In drei Monaten möchte ich das Zertifikat für den Kurs erwerben.; InformCompletionGoal
Ich möchte den Kurs innerhalb von drei Monaten erfolgreich durchlaufen haben.; InformCompletionGoal
Mein Plan ist es, den Kurs in drei Monaten abgeschlossen zu haben.; InformCompletionGoal
Ich möchte in drei Monaten alle Kursinhalte durchgearbeitet haben.; InformCompletionGoal
Mein Ziel ist es, in drei Monaten alle Prüfungen des Kurses bestanden zu haben.; InformCompletionGoal
Mein Ziel ist es, in drei Monaten alle Kurseinheiten durchgearbeitet zu haben.; InformCompletionGoal
In drei Monaten sollte ich mit dem Kurs fertig sein.; InformCompletionGoal
Mein Ziel ist es, in drei Monaten den Kurs zu bestehen.; InformCompletionGoal
In drei Monaten möchte ich den Kurs erfolgreich abschließen.; InformCompletionGoal
In drei Monaten möchte ich alle Lernziele des Kurses erreicht haben.; InformCompletionGoal
Mein Ziel ist es, in drei Monaten mit dem Kurs fertig zu sein.; InformCompletionGoal
In drei Monaten möchte ich den Kurs erfolgreich absolvieren.; InformCompletionGoal
Mein Ziel ist es, in drei Monaten das Zertifikat für den Kurs in den Händen zu halten.; InformCompletionGoal
Ich strebe an, den Kurs in drei Monaten erfolgreich abzuschließen.; InformCompletionGoal
Ich möchte meinen Kurs innerhalb von drei Monaten abschließen.; InformCompletionGoal
Mein Ziel ist es, den Kurs in drei Monaten abgeschlossen zu haben.; InformCompletionGoal
Es ist mein Ziel, in drei Monaten mit dem Kurs fertig zu sein.; InformCompletionGoal
Ich strebe an, in drei Monaten fertig zu sein.; InformCompletionGoal
Ich habe vor, innerhalb von drei Monaten mit dem Kurs fertig zu werden.; InformCompletionGoal
Ich habe vor, den Kurs in drei Monaten zu beenden.; InformCompletionGoal
Ich habe den Wunsch, in drei Monaten den Kurs abgeschlossen zu haben.; InformCompletionGoal
Innerhalb von drei Monaten will ich den Kurs durchlaufen haben.; InformCompletionGoal
In drei Monaten möchte ich mit dem Kurs fertig sein.; InformCompletionGoal
Es ist mein Ziel, in drei Monaten den Kurs erfolgreich abzuschließen und das Zertifikat zu erhalten.; InformCompletionGoal
Mein Ziel ist es, innerhalb von drei Monaten den Kurs abzuschließen.; InformCompletionGoal
Ich habe vor, innerhalb von drei Monaten den Kurs zu beenden.; InformCompletionGoal
Innerhalb von drei Monaten möchte ich den Kurs erfolgreich absolvieren.; InformCompletionGoal
Ich plane, in drei Monaten mit dem Kurs fertig zu sein.; InformCompletionGoal
Gibt es ein Thema, das ich in nur 30 Minuten verstehen kann?; InformTimeConstraint
Ich muss in 30 Minuten fertig sein, welche Module sind kurz genug, um in dieser Zeit abgeschlossen zu werden?; InformTimeConstraint
Ich kann heute nur eine kurze Zeit lernen, was ist empfehlenswert?; InformTimeConstraint
Kann ich etwas Nützliches in nur 30 Minuten lernen?; InformTimeConstraint
Gibt es ein Thema, das ich in kurzer Zeit verstehen kann?; InformTimeConstraint
Welche Einheit passt in meine beschränkte Lernzeit von 30 Minuten?; InformTimeConstraint
Welches Thema ist am besten für eine schnelle halbe Stunde Lernzeit geeignet?; InformTimeConstraint
Welches Modul kann ich in 30 Minuten schaffen?; InformTimeConstraint
Ich habe heute nur eine halbe Stunde Zeit, welche Lektion ist am besten für mich?; InformTimeConstraint
Welches Thema kann ich in einer kurzen halben Stunde durchgehen?; InformTimeConstraint
Gibt es ein Thema, das ich in 30 Minuten verstehen kann und das mir hilft, meine Fähigkeiten zu verbessern?; InformTimeConstraint
Ich habe nur 30 Minuten übrig, was ist die beste Verwendung meiner Lernzeit?; InformTimeConstraint
Ich habe nur 30 Minuten Zeit, was ist die beste Verwendung meiner Lernzeit?; InformTimeConstraint
Welches Modul ist für meine begrenzte Lernzeit geeignet?; InformTimeConstraint
Welches Modul kann ich in 30 Minuten erledigen?; InformTimeConstraint
Ich habe nicht viel Zeit heute, können Sie mir eine kurze Einheit empfehlen?; InformTimeConstraint
Gibt es ein Thema, das ich in einer halben Stunde bewältigen kann?; InformTimeConstraint
Ich habe 30 Minuten übrig, welche Lerneinheiten sind am effektivsten?; InformTimeConstraint
Was kann ich tun, um in einer kurzen Zeitspanne Fortschritte zu machen?; InformTimeConstraint
Kannst du mir ein Thema empfehlen, das ich in einer halben Stunde schaffen kann?; InformTimeConstraint
Ich habe nur 30 Minuten Zeit, was sollte ich tun, um den größtmöglichen Nutzen zu erzielen?; InformTimeConstraint
Kannst du mir eine Einheit empfehlen, die in 30 Minuten abgeschlossen werden kann?; InformTimeConstraint
Kannst du mir etwas vorschlagen, das ich in 30 Minuten durchgehen kann?; InformTimeConstraint
Ich möchte mein Lernen auf eine halbe Stunde beschränken, was schlägst du vor?; InformTimeConstraint
Ich habe heute nur 30 Minuten; InformTimeConstraint
Ich habe heute nur eine halbe Stunde Zeit, was kann ich tun?; InformTimeConstraint
Gibt es ein Modul, das ich in 30 Minuten abschließen kann und das einen hohen Lernerfolg bringt?; InformTimeConstraint
Ich möchte eine Lerneinheit finden, die ich in einer halben Stunde durchgehen kann. Was schlagen Sie vor?; InformTimeConstraint
Kann ich in nur 30 Minuten Fortschritte machen?; InformTimeConstraint
Wie kann ich meine Zeit am besten nutzen, wenn ich nur 30 Minuten habe?; InformTimeConstraint
Ich möchte meine knappe Lernzeit von 30 Minuten optimal nutzen, was schlägst du vor?; InformTimeConstraint
Was kann ich in einer halben Stunde lernen, um meine Lernziele zu erreichen?; InformTimeConstraint
Ich habe nur eine begrenzte Zeit zur Verfügung, welche Einheit/Modul/Thema sollte ich priorisieren?; InformTimeConstraint
Was kann ich in 30 Minuten tun, um weiterzukommen?; InformTimeConstraint
Was kann ich tun, um in einer halben Stunde das meiste aus meiner Lernzeit herauszuholen?; InformTimeConstraint
Welches Thema kann ich schnell durchgehen, um Zeit zu sparen?; InformTimeConstraint
Kannst du mir eine kurze Lektion empfehlen, die in einer halben Stunde abgeschlossen werden kann?; InformTimeConstraint
Ich habe nicht viel Zeit, aber ich möchte trotzdem lernen, welche Optionen gibt es?; InformTimeConstraint
Welches Modul ist am besten für meine kurze Lernzeit geeignet?; InformTimeConstraint
Welches Modul kann ich in einer kurzen halben Stunde absolvieren?; InformTimeConstraint
Ich habe begrenzte Zeit zur Verfügung, welche Lernmodule wären am effektivsten?; InformTimeConstraint
Ich muss in einer halben Stunde fertig sein, was empfehlen Sie?; InformTimeConstraint
Ich habe heute nicht viel Zeit, was sind meine Optionen?; InformTimeConstraint
Welche Lektion ist kurz genug, um in 30 Minuten abgeschlossen zu werden?; InformTimeConstraint
Ist es möglich, in nur 30 Minuten etwas zu lernen, und wenn ja, was empfehlen Sie?; InformTimeConstraint
Ich habe nicht viel Zeit heute, was empfiehlst du mir zu lernen?; InformTimeConstraint
Ich möchte in 30 Minuten so viel wie möglich lernen, welche Einheit empfiehlst du?; InformTimeConstraint
Kannst du mir eine schnelle Lektion empfehlen, die ich in 30 Minuten machen kann?; InformTimeConstraint
Welches Thema kann ich in 30 Minuten bewältigen?; InformTimeConstraint
Ich möchte das Beste aus meinen 30 Minuten Lernzeit herausholen, was ist empfehlenswert?; InformTimeConstraint
Welche Themen sind kurz genug für eine halbe Stunde Lernzeit?; InformTimeConstraint
Ich habe nur 30 Minuten Zeit zum Lernen, was ist das Beste, was ich tun kann?; InformTimeConstraint
Gibt es ein Modul, das ich in einer halben Stunde erledigen kann?; InformTimeConstraint
Welche Module/Einheiten/Themen sind kurz genug, um in nur 30 Minuten abgeschlossen zu werden?; InformTimeConstraint
Welche Themen sind in nur 30 Minuten erlernbar?; InformTimeConstraint
Könntest du bitte alle weiteren verfügbaren Ergebnisse anzeigen, die meiner vorherigen Suche entsprechen?; LoadMoreSearchResults
Gibt es noch mehr Resultate, die meiner Suche entsprechen?; LoadMoreSearchResults
Könntest du bitte alle weiteren verfügbaren Ergebnisse anzeigen?; LoadMoreSearchResults
Könntest du mir bitte weitere Ergebnisse anzeigen, die meiner Suche entsprechen?; LoadMoreSearchResults
Ich brauche noch weitere Informationen zu meinem Thema. Kannst du mir weitere Ergebnisse anzeigen?; LoadMoreSearchResults
Zeige mir weitere Ergebnisse.; LoadMoreSearchResults
Zeige mir bitte alle weiteren passenden Ergebnisse.; LoadMoreSearchResults
Kannst du mir bitte weitere relevante Ergebnisse zeigen?; LoadMoreSearchResults
Kannst du mir bitte noch mehr Informationen zu meinem Thema zeigen?; LoadMoreSearchResults
Gibt es noch weitere Suchergebnisse, die ich übersehen habe?; LoadMoreSearchResults
Kannst du mir bitte alle verfügbaren Ergebnisse anzeigen, die meiner Suche entsprechen?; LoadMoreSearchResults
Zeige mir bitte alle verfügbaren Ergebnisse, die meiner Suche entsprechen.; LoadMoreSearchResults
Ich benötige weitere Informationen, um meine Suche zu vervollständigen. Könntest du mir bitte weiterhelfen?; LoadMoreSearchResults
Könntest du mir bitte weitere Informationen zu diesem Thema zur Verfügung stellen?; LoadMoreSearchResults
Ich bin noch nicht zufrieden mit den Suchergebnissen. Könntest du mir weitere zeigen?; LoadMoreSearchResults
Ich brauche mehr Ergebnisse, um meine Recherche abzuschließen.; LoadMoreSearchResults
Kannst du mir bitte noch mehr relevante Suchergebnisse zeigen?; LoadMoreSearchResults
Ich benötige mehr Suchergebnisse, um meine Recherche abzuschließen.; LoadMoreSearchResults
Ich hätte gerne weitere relevante Suchergebnisse. Könntest du mir bitte helfen?; LoadMoreSearchResults
Gibt es noch andere Suchergebnisse, die ich übersehen habe? Könntest du sie mir bitte zeigen?; LoadMoreSearchResults
Ich möchte gerne alle weiteren passenden Ergebnisse angezeigt bekommen.; LoadMoreSearchResults
Ich möchte gerne weitere relevante Ergebnisse sehen.; LoadMoreSearchResults
Ich würde gerne meine Suche erweitern. Kannst du mir weitere Ergebnisse anzeigen?; LoadMoreSearchResults
Gibt es noch weitere relevante Informationen zu diesem Thema, die ich übersehen habe?; LoadMoreSearchResults
Ich bin noch nicht fündig geworden. Könntest du mir weitere relevante Ergebnisse zeigen?; LoadMoreSearchResults
Ich benötige weitere Informationen zu meinem Thema. Könntest du mir weitere Suchergebnisse anzeigen?; LoadMoreSearchResults
Könntest du mir bitte weitere relevante Suchergebnisse präsentieren?; LoadMoreSearchResults
Könntest du mir bitte noch weitere relevante Suchergebnisse anzeigen?; LoadMoreSearchResults
Gibt es noch weitere relevante Suchergebnisse, die ich übersehen habe? Könntest du sie mir bitte zeigen?; LoadMoreSearchResults
Ich brauche noch mehr Informationen zu meinem Thema.; LoadMoreSearchResults
Ich brauche weitere Informationen, um meine Recherche zu vervollständigen. Kannst du mir bitte helfen?; LoadMoreSearchResults
Könntest du bitte alle weiteren Ergebnisse zu diesem Thema anzeigen?; LoadMoreSearchResults
Gibt es noch mehr Resultate, die relevant für meine Suche sind?; LoadMoreSearchResults
Ich brauche noch mehr Ergebnisse zu meiner vorherigen Suche. Kannst du mir helfen?; LoadMoreSearchResults
Ich hätte gerne weitere Suchergebnisse, um meine Suche zu erweitern.; LoadMoreSearchResults
Kannst du mir weitere relevante Suchergebnisse anzeigen, die ich übersehen habe?; LoadMoreSearchResults
Kannst du mir bitte alle weiteren relevanten Suchergebnisse anzeigen?; LoadMoreSearchResults
Könntest du mir bitte weitere Informationen zu diesem Thema zur Verfügung stellen, die ich noch nicht gesehen habe?; LoadMoreSearchResults
Könntest du mir bitte weitere relevante Ergebnisse anzeigen?; LoadMoreSearchResults
Ich brauche mehr Informationen. Kannst du mir bitte weitere Ergebnisse zeigen?; LoadMoreSearchResults
Ich hätte gerne noch mehr Suchergebnisse zu diesem Thema. Kannst du mir weiterhelfen?; LoadMoreSearchResults
Kannst du mir noch weitere relevante Suchergebnisse zeigen?; LoadMoreSearchResults
Ich benötige mehr Informationen zu diesem Thema. Kannst du mir weitere Ergebnisse zeigen?; LoadMoreSearchResults
Ich brauche noch mehr Ergebnisse, um meine Suche zu vervollständigen.; LoadMoreSearchResults
Zeig mir bitte alle weiteren verfügbaren Ergebnisse.; LoadMoreSearchResults
Könntest du mir bitte zusätzliche Suchergebnisse zeigen?; LoadMoreSearchResults
Könntest du mir bitte mehr Suchergebnisse präsentieren?; LoadMoreSearchResults
Ich benötige noch mehr Ergebnisse, um meine Suche abzuschließen.; LoadMoreSearchResults
Zeige mir bitte noch mehr Suchergebnisse, die meiner vorherigen Suche entsprechen.; LoadMoreSearchResults
Könntest du mir bitte alle weiteren verfügbaren Ergebnisse anzeigen?; LoadMoreSearchResults
Gibt es noch andere relevante Suchergebnisse, die ich übersehen habe?; LoadMoreSearchResults
Gibt es noch andere passende Suchergebnisse, die ich übersehen habe?; LoadMoreSearchResults
Ich brauche weitere Resultate, um meine Suche zu vervollständigen.; LoadMoreSearchResults
Kannst du mir bitte alle weiteren verfügbaren Suchergebnisse präsentieren?; LoadMoreSearchResults
Zeig mir bitte alle Resultate, die meiner Suche entsprechen.; LoadMoreSearchResults
Zeige mir bitte alle weiteren Resultate, die meiner Suche entsprechen.; LoadMoreSearchResults
Könntest du mir bitte alle weiteren relevanten Ergebnisse zeigen, die zu meiner Suche passen?; LoadMoreSearchResults
Ich würde gerne meine Suche erweitern. Könntest du mir weitere relevante Informationen anzeigen?; LoadMoreSearchResults
Zeig mir bitte alle verfügbaren Resultate, die meiner Suche entsprechen.; LoadMoreSearchResults
Gibt es noch weitere relevante Resultate, die du mir präsentieren kannst?; LoadMoreSearchResults
Nein, das ist nicht akkurat.; No
Nein, das ist nicht der Fall.; No
Das ist nicht angebracht.; No
Das ist nicht das, was ich meine.; No
Das ist nicht meine Erfahrung.; No
Das ist nicht gebilligt.; No
Das ist nicht meine Meinung.; No
Das ist nicht gestattet.; No
Das ist nicht akzeptiert.; No
Nein; No
Das stimmt nicht überein.; No
Das ist nicht das, was ich gehört habe.; No
Das ist nicht wahr.; No
Das ist nicht die richtige Antwort.; No
Das ist nicht das, was ich verstehe.; No
Das ist nicht erforderlich.; No
Nicht richtig.; No
Das kann ich nicht erlauben.; No
Das ist nicht der Status quo.; No
Das ist nicht erwünscht.; No
Das ist nicht der richtige Weg.; No
Nein, das ist nicht die Lösung.; No
Das ist nicht der Stand der Dinge.; No
Das ist nicht passend.; No
Das ist nicht akzeptabel.; No
Nicht akzeptabel.; No
Das ist nicht angebracht.; No
Das ist nicht das Ergebnis, das ich erwartet habe.; No
Das ist nicht zutreffend.; No
Das ist nicht erlaubt.; No
Das ist nicht die Realität.; No
Das ist nicht angemessen.; No
Falsch.; No
Das ist nicht das, was ich denke.; No
Das ist nicht die Tatsache.; No
Das ist nicht notwendig.; No
Nein, das stimmt nicht überein.; No
Das ist nicht korrekt.; No
Das kann ich nicht bestätigen.; No
Das ist nicht angemessen.; No
Nicht korrekt.; No
Kein Interesse.; No
Auf keinen Fall.; No
Leider muss ich widersprechen.; No
Das ist falsch.; No
Definitiv nicht.; No
Nein, das ist nicht richtig.; No
Das ist nicht genehmigt.; No
Das stimmt nicht.; No
Leider nicht.; No
Das ist nicht der Fall.; No
Das ist nicht genehmigt.; No
Leider nein.; No
Das ist nicht die Wahrheit.; No
Ich fürchte nein.; No
Das ist nicht wahrheitsgemäß.; No
Nicht wahr.; No
Nein, das ist nicht korrekt.; No
Nö.; No
Nicht möglich.; No
Kein bisschen.; No
Das ist nicht zutreffend.; No
Absolut nicht.; No
Das ist nicht geeignet.; No
Welche anderen Themen sind noch relevant?; RequestAlternativeNextModule
Gibt es noch andere Themen, die für mich relevant sind?; RequestAlternativeNextModule
Was sind meine Alternativen für das nächste Modul?; RequestAlternativeNextModule
Welche anderen Themen/Einheiten gibt es noch?; RequestAlternativeNextModule
Welche weiteren Möglichkeiten stehen mir zur Verfügung, um mein Wissen zu erweitern?; RequestAlternativeNextModule
Was kann ich als nächstes lernen?; RequestAlternativeNextModule
Welche Lernmodule empfiehlst du mir als nächstes?; RequestAlternativeNextModule
Kannst du mir helfen, das nächste Kapitel auszuwählen?; RequestAlternativeNextModule
Was sind meine Alternativen, um meine Kenntnisse zu erweitern?; RequestAlternativeNextModule
Was gibt es noch, um meinen Wissensstand zu erweitern?; RequestAlternativeNextModule
Gibt es noch andere Module, die ich absolvieren kann?; RequestAlternativeNextModule
Was kann ich noch tun, um meine Fähigkeiten zu verbessern?; RequestAlternativeNextModule
Was ist das nächste Modul, das ich bearbeiten kann?; RequestAlternativeNextModule
Was gibt es noch, um mein Wissen zu erweitern?; RequestAlternativeNextModule
Was sind meine alternativen Lernmöglichkeiten?; RequestAlternativeNextModule
Kannst du mir andere Lerninhalte empfehlen?; RequestAlternativeNextModule
Was ist das nächste Lernziel?; RequestAlternativeNextModule
Was sind meine Optionen, um mehr zu erfahren?; RequestAlternativeNextModule
Was gibt es noch, was ich lernen kann?; RequestAlternativeNextModule
Was kann ich tun, um mein Wissen zu erweitern?; RequestAlternativeNextModule
Welche anderen Themen stehen zur Verfügung?; RequestAlternativeNextModule
Welche weiteren Lernoptionen gibt es, um meine Fähigkeiten zu erweitern?; RequestAlternativeNextModule
Was gibt es noch, was ich erforschen kann?; RequestAlternativeNextModule
Was ist der nächste Schritt auf meiner Lernreise?; RequestAlternativeNextModule
Welche anderen Themen können mir helfen, meine Ziele zu erreichen?; RequestAlternativeNextModule
Was kann ich noch tun, um meine Kompetenzen zu verbessern?; RequestAlternativeNextModule
Welche anderen Themen sind noch relevant für meine Ausbildung?; RequestAlternativeNextModule
Gibt es andere Lernmodule, die ich angehen kann?; RequestAlternativeNextModule
Welche anderen Module stehen zur Verfügung?; RequestAlternativeNextModule
Was ist das nächste Kapitel, das ich durchgehen sollte?; RequestAlternativeNextModule
Welche weiteren Themen stehen zur Verfügung?; RequestAlternativeNextModule
Welche weiteren Themen und Module sind für mich relevant?; RequestAlternativeNextModule
Welche anderen Themenbereiche gibt es?; RequestAlternativeNextModule
Was sind meine nächsten Lernschritte?; RequestAlternativeNextModule
Kannst du mir weitere Lerninhalte zur Verfügung stellen?; RequestAlternativeNextModule
Was sind meine weiteren Lernmöglichkeiten?; RequestAlternativeNextModule
Wo kann ich weitere Lektionen finden?; RequestAlternativeNextModule
Gibt es noch weitere Lerneinheiten?; RequestAlternativeNextModule
Was ist das nächste Thema?; RequestAlternativeNextModule
Was kann ich noch lernen?; RequestAlternativeNextModule
Was gibt es noch zu lernen, um mein Wissen zu erweitern?; RequestAlternativeNextModule
Was sind meine Möglichkeiten, um weiterzulernen?; RequestAlternativeNextModule
Was ist die nächste Lerneinheit?; RequestAlternativeNextModule
Was kann ich tun, um meine Kenntnisse zu vertiefen?; RequestAlternativeNextModule
Was ist der nächste Bereich, den ich erforschen kann?; RequestAlternativeNextModule
Was kann ich sonst noch machen?; RequestAlternativeNextModule
Welche Themen sind noch offen?; RequestAlternativeNextModule
Was sind meine nächsten Möglichkeiten für das Lernen?; RequestAlternativeNextModule
Welche Optionen habe ich für mein Lernprogramm?; RequestAlternativeNextModule
Welche weiteren Lerninhalte sind für mich verfügbar?; RequestAlternativeNextModule
Welche Inhalte stehen mir noch zur Verfügung?; RequestAlternativeNextModule
Was ist der nächste Schritt auf meiner Lernreise?; RequestAlternativeNextModule
Kannst du mir weitere Lernquellen empfehlen?; RequestAlternativeNextModule
Was sind meine nächsten Schritte auf meinem Lernweg?; RequestAlternativeNextModule
Was sind meine Optionen für die nächste Lernphase?; RequestAlternativeNextModule
Was sind meine Optionen für weitere Lerninhalte?; RequestAlternativeNextModule
Welche anderen Themen sind in meinem Lernprogramm enthalten?; RequestAlternativeNextModule
Kann ich weitere Lernmöglichkeiten nutzen?; RequestAlternativeNextModule
Was kann ich noch tun, um meine Kenntnisse zu erweitern?; RequestAlternativeNextModule
Was sind die anderen verfügbaren Lernressourcen?; RequestAlternativeNextModule
Was sind meine Optionen für die nächste Lektion?; RequestAlternativeNextModule
Welche anderen Themenbereiche kann ich erkunden?; RequestAlternativeNextModule
Welche anderen Kapitel kann ich studieren?; RequestAlternativeNextModule
Was kann ich sonst noch lernen, um meine Fähigkeiten zu verbessern?; RequestAlternativeNextModule
Was sind meine weiteren Lernoptionen?; RequestAlternativeNextModule
Gibt es einen Test, den ich machen kann, um mich auf dieses Thema vorzubereiten?; RequestTest
Kann ich einen Test absolvieren, um meine Kenntnisse in diesem Bereich zu überprüfen?; RequestTest
Wäre es angebracht, einen Test zu diesem Thema zu machen, um meine Vorbereitung zu überwachen?; RequestTest
Kann ich einen Test durchführen, um mein Verständnis für dieses Thema zu überprüfen?; RequestTest
Wäre es sinnvoll, einen Test zu diesem Thema zu machen, um meine Vorbereitung zu überprüfen?; RequestTest
Kann ich einen Test absolvieren, um meine Leistung in diesem Thema zu überprüfen?; RequestTest
Kann ich einen Test machen, um meine Fähigkeiten in diesem Bereich zu testen?; RequestTest
Wäre es hilfreich, einen Test zu diesem Thema zu machen, um meine Vorbereitung zu verifizieren?; RequestTest
Kann ich einen Test durchlaufen, um meine Fähigkeiten in Bezug auf dieses Thema zu überprüfen?; RequestTest
Wäre es möglich, einen Test zu diesem Thema zu absolvieren, um meine Vorbereitung zu verbessern?; RequestTest
Gibt es eine Möglichkeit, mein Wissen durch einen Test oder eine Prüfung zu überprüfen?; RequestTest
Würde es mir helfen, einen Test in diesem Bereich zu machen?; RequestTest
Kann ich einen Test durchführen, um mein Wissen in Bezug auf dieses Thema zu überprüfen?; RequestTest
Kann ich einen Test oder eine Prüfung zu diesem Thema machen?; RequestTest
Kann ich einen Test absolvieren, um zu sehen, wie viel ich in diesem Thema gelernt habe?; RequestTest
Gibt es einen Test, den ich machen kann, um mein Wissen zu überprüfen?; RequestTest
Könnte ich einen Test machen, um meine Fähigkeiten auf diesem Gebiet zu testen?; RequestTest
Gibt es eine Möglichkeit, meine Kenntnisse in diesem Thema durch einen Test oder eine Prüfung zu bewerten?; RequestTest
Kann ich einen Test machen, um zu sehen, wie gut ich in diesem Thema bin?  ; RequestTest
Kann ich einen Test machen, um zu sehen, wie weit ich in diesem Thema gekommen bin?; RequestTest
Ich würde gerne meine Fähigkeiten in diesem Thema durch einen Test verbessern, geht das?; RequestTest
Kann ich einen Test durchlaufen, um meine Kompetenz in diesem Thema zu überprüfen?; RequestTest
Wäre es ratsam, einen Test zu diesem Thema zu machen, um meine Vorbereitung zu überdenken?; RequestTest
Kann ich einen Test absolvieren, um meine Kenntnisse zu diesem Thema zu überprüfen?; RequestTest
Könnte ich einen Test machen, um zu sehen, wie gut ich in diesem Thema bin?; RequestTest
Kann ich einen Test absolvieren, um meine Fähigkeiten in Bezug auf dieses Thema zu überprüfen?; RequestTest
Kann ich einen Test absolvieren, um meine Leistung in Bezug auf dieses Thema zu überprüfen?#; RequestTest
Wäre es hilfreich, einen Test zu diesem Thema zu machen, um meine Vorbereitung zu evaluieren?; RequestTest
Wäre es angebracht, einen Test zu diesem Thema zu machen, um meine Vorbereitung zu kontrollieren?; RequestTest
Kann ich einen Test machen, um meine Kenntnisse in diesem Thema zu überprüfen?; RequestTest
Könnte ich einen Test absolvieren, um meine Fortschritte in diesem Thema zu messen?; RequestTest
Kann ich einen Test absolvieren, um meine Fortschritte in Bezug auf dieses Thema zu überprüfen?; RequestTest
Ich möchte mich auf eine Prüfung vorbereiten, gibt es einen Test, den ich machen kann?; RequestTest
Wäre es sinnvoll, einen Test zu diesem Thema zu machen, um meine Vorbereitung zu validieren?; RequestTest
Könnte ich einen Test machen, um meine Schwächen in diesem Thema zu identifizieren?; RequestTest
Könnte ich einen Test in Bezug auf dieses Thema absolvieren, um mich vorzubereiten?; RequestTest
Ich möchte mein Verständnis für das Thema überprüfen, kann ich einen Test machen?; RequestTest
Kann ich einen Test durchlaufen, um meine Kenntnisse in Bezug auf dieses Thema zu überprüfen?; RequestTest
Kannst du mir einen Test empfehlen, um mein Verständnis für das Thema zu verbessern?; RequestTest
Gibt es einen Test, den ich absolvieren kann, um mein Wissen zu bewerten?; RequestTest
Wäre es sinnvoll, einen Test zu machen, bevor ich mit dem nächsten Modul beginne?; RequestTest
Kann ich einen Test machen, um meine Fähigkeiten in diesem Thema zu verbessern?; RequestTest
Kann ich einen Test durchführen, um mich auf dieses Thema vorzubereiten?; RequestTest
Ist es möglich, einen Test zu diesem Thema zu machen, um mich vorzubereiten?; RequestTest
