Einen schönen Tag noch!; Bye
Ich muss jetzt gehen.; Bye
Bis später!; Bye
Bis bald!; Bye
Bis zum nächsten Mal und viel Erfolg.; Bye
Wir hören uns!; Bye
Ich wünsche dir einen schönen Tag.; Bye
Ich bin dann mal weg.; Bye
Wir hören voneinander!; Bye
Wir sehen uns bald wieder!; Bye
Bis zum nächsten Mal!; Bye
Bis zum nächsten Mal und viel Glück!; Bye
Pass auf dich auf!; Bye
Tschö mit ö!; Bye
Tschüssikowsky!; Bye
Ich bin dann mal weg!; Bye
Bis bald und alles Gute.; Bye
Servus.; Bye
Bis zum nächsten Mal und bleib gesund.; Bye
Bis zum nächsten Mal und viel Spaß!; Bye
Auf Wiedersehen!; Bye
Bis zum nächsten Mal und viel Erfolg!; Bye
Bis zum nächsten Mal.; Bye
Bis später dann.; Bye
Bis zum nächsten Mal und vielen Dank!; Bye
Tschüssi.; Bye
Schöne Zeit noch!; Bye
Wir sehen uns später wieder.; Bye
Ich melde mich später wieder.; Bye
Mach's gut!; Bye
Tschööö!; Bye
Es war mir eine Freude, mit dir zu sprechen!; Bye
Ich muss los.; Bye
Tschüssikowski!; Bye
Wir hören uns wieder.; Bye
Tschau!; Bye
Auf Wiedersehen.; Bye
Tschüss; Bye
Bis zum nächsten Mal.; Bye
Wir hören voneinander.; Bye
Pass auf dich auf.; Bye
Schönen Abend noch.; Bye
Wir hören uns später wieder!; Bye
Bis dann und bleib gesund!; Bye
Ciao!; Bye
Ich verabschiede mich für jetzt!; Bye
Wir sehen uns!; Bye
Schönen Abend noch!; Bye
Bis demnächst!; Bye
Mach's gut und bis bald!; Bye
Schönen Tag noch.; Bye
Auf Wiedersehen und vielen Dank.; Bye
Einen schönen Tag dir noch.; Bye
Tschö.; Bye
Auf Wiederhören!; Bye
Wir hören uns bald wieder, Tschüss!; Bye
Wir hören uns später.; Bye
Mach's gut.; Bye
Wir sprechen uns bald wieder!; Bye
Bis zum nächsten Mal und eine gute Zeit!; Bye
Bis zum nächsten Gespräch!; Bye
Bis zum nächsten Mal und viel Glück.; Bye
Bis zum nächsten Mal und viel Spaß.; Bye
Bis demnächst und viel Erfolg!; Bye
Ich möchte mich jetzt auf Bücher beschränken.; ChangeConfig
Ich suche nur nach Buchressourcen, hast du Empfehlungen?; ChangeConfig
Kannst du mir nur Buchempfehlungen geben?; ChangeConfig
Gibt es eine Option, nur Bücher zu durchsuchen?; ChangeConfig
Könntest du mir ausschließlich Buchempfehlungen geben?; ChangeConfig
Ich möchte mich auf Buchressourcen beschränken.; ChangeConfig
Könntest du mir nur Buchempfehlungen geben?; ChangeConfig
Ich bevorzuge es, mich auf Bücher zu beschränken.; ChangeConfig
Kannst du meine Suche auf Buchquellen beschränken?; ChangeConfig
Bitte filtere die Suchergebnisse auf Bücher.; ChangeConfig
Bitte filtere die Ergebnisse, damit ich nur Bücher sehe.; ChangeConfig
Bitte empfehle mir nur Bücher als Suchergebnisse.; ChangeConfig
Ich möchte mich nur auf Buchempfehlungen konzentrieren.; ChangeConfig
Ich bin nur an Büchern interessiert, kannst du mir helfen?; ChangeConfig
Kannst du mir nur Büchervorschläge geben?; ChangeConfig
Ich will nur Buchergebnisse sehen.; ChangeConfig
Bitte schlage mir nur Buchquellen vor.; ChangeConfig
Ich bin nur an Büchern interessiert.; ChangeConfig
Ich suche nur nach Büchern, hast du Empfehlungen?; ChangeConfig
Ich möchte mich auf Bücher beschränken.; ChangeConfig
Gibt es eine Option, nur nach Büchern zu suchen?; ChangeConfig
Bitte schlage mir nur Buchquellen zum Lesen vor.; ChangeConfig
Gibt es eine Option, nur Bücher zu suchen?; ChangeConfig
Bitte beschränke die Suche auf Bücher.; ChangeConfig
Ich möchte mich auf Bücher konzentrieren, hast du Empfehlungen?; ChangeConfig
Ich würde gerne nur Buchempfehlungen bekommen.; ChangeConfig
Ich will nur Buch-Ergebnisse sehen.; ChangeConfig
Ich interessiere mich nur für Bücher.; ChangeConfig
Bitte schlage mir nur Buchquellen als Suchergebnisse vor.; ChangeConfig
Ich bevorzuge es, mich auf Bücher zu konzentrieren.; ChangeConfig
Ich möchte nur Bücher als Suchergebnisse bekommen.; ChangeConfig
Ich hätte gerne eine Suche, die sich nur auf Bücher konzentriert.; ChangeConfig
Bitte beschränke die Suche auf Bücher.; ChangeConfig
Könntest du meine Suche auf Bücher beschränken?; ChangeConfig
Gibt es eine Möglichkeit, nur Bücher als Suchquelle zu haben?; ChangeConfig
Lass mich nur Buchempfehlungen finden.; ChangeConfig
Ich bin nur an Buchquellen interessiert.; ChangeConfig
Ich will mich nur auf Bücher konzentrieren.; ChangeConfig
Ich bevorzuge es, nur Buchquellen zu haben.; ChangeConfig
Ich bevorzuge es, nur Buchquellen zu haben.; ChangeConfig
Ich möchte mich nur auf Bücher konzentrieren.; ChangeConfig
Ich will mich nur auf Bücher konzentrieren.; ChangeConfig
Kannst du mir ausschließlich Buchvorschläge geben?; ChangeConfig
Kannst du meine Suche auf Bücher beschränken?; ChangeConfig
Kannst du mir nur Buchressourcen empfehlen?; ChangeConfig
Kannst du mir nur Buchvorschläge geben?; ChangeConfig
Bitte gib mir nur Buchvorschläge.; ChangeConfig
Lass mich nur Buchressourcen finden.; ChangeConfig
Bitte empfehle mir nur Bücher zum Lesen.; ChangeConfig
Bitte gib mir nur Buchquellen.; ChangeConfig
Bitte schlage mir nur Bücher als Suchergebnisse vor.; ChangeConfig
Bitte schlage mir nur Bücher zum Lesen vor.; ChangeConfig
Könnten wir uns nur auf Bücher konzentrieren?; ChangeConfig
Ich will mich nur auf Buchquellen konzentrieren.; ChangeConfig
Ich bin nur an Buchquellen interessiert.; ChangeConfig
Können wir die Suche auf Bücher eingrenzen?; ChangeConfig
Ich bin nur an Buchressourcen interessiert, kannst du mir helfen?; ChangeConfig
Kannst du mir nur Buchvorschläge geben?; ChangeConfig
Gibt es eine Möglichkeit, nur Buchquellen zu haben?; ChangeConfig
Gibt es eine Möglichkeit, nur nach Büchern zu suchen?; ChangeConfig
Könnten Sie mir nur Buch-spezifische Informationen geben?; ChangeConfig
Kannst du mich auf Bücher spezialisieren?; ChangeConfig
Ich will nur nach Büchern suchen.; ChangeConfig
Ich bin auf der Suche nach Buchressourcen, kannst du mir helfen?; ChangeConfig
Ich habe alle Themen und Herausforderungen in diesem Modul bearbeitet und bin nun fertig.; GetNextModule
Ich habe alle Übungen und Aufgaben des Moduls erfolgreich absolviert.; GetNextModule
Ich bin nun mit diesem Modul fertig.; GetNextModule
Ich bin nun mit allen Aufgaben dieses Moduls durch.; GetNextModule
Ich habe alle Lernziele in diesem Modul erreicht und bin nun fertig.; GetNextModule
Ich habe alle Herausforderungen und Aufgaben in diesem Modul gemeistert und bin nun bereit für neue Lernziele.; GetNextModule
Ich habe alle Themen und Anforderungen in diesem Modul erfüllt und bin nun fertig.; GetNextModule
Das aktuelle Kapitel ist nun für mich beendet.; GetNextModule
Das Modul wurde erfolgreich abgeschlossen und ich bin stolz auf meine Leistung.; GetNextModule
Ich habe alle Herausforderungen in diesem Modul erfolgreich gemeistert.; GetNextModule
Ich habe alle Testfragen in diesem Modul richtig beantwortet.; GetNextModule
Ich habe alle Lernziele in diesem Modul erreicht.; GetNextModule
Ich habe alle Fragen in diesem Modul richtig beantwortet.; GetNextModule
Ich habe alle Aufgaben und Übungen in diesem Modul erfolgreich erledigt.; GetNextModule
Ich habe alle erforderlichen Schritte in diesem Modul erledigt.; GetNextModule
Das Modul wurde erfolgreich abgeschlossen und ich bin bereit für neue Lernziele.; GetNextModule
Ich habe alle Abschnitte des Moduls erfolgreich abgeschlossen.; GetNextModule
Ich habe alle Themen und Aufgaben des Moduls erfolgreich bearbeitet und bin nun fertig.; GetNextModule
Ich habe alle Anforderungen und Aufgaben in diesem Modul erfüllt und bin nun abgeschlossen.; GetNextModule
Ich habe alle Anforderungen dieses Moduls erfolgreich erfüllt.; GetNextModule
Ich habe alle Inhalte des Moduls vollständig verstanden.; GetNextModule
Das Modul wurde von mir vollständig durchgearbeitet und ich bin nun fertig.; GetNextModule
Ich habe alle erforderlichen Prüfungen und Aufgaben in diesem Modul gemeistert und bin nun fertig.; GetNextModule
Ich habe alle Aufgaben in diesem Modul erfolgreich bearbeitet.; GetNextModule
Ich habe alle Inhalte und Aufgaben des Moduls erledigt und bin nun fertig.; GetNextModule
Ich habe alle Lernziele des Moduls erfolgreich erreicht.; GetNextModule
Ich bin mit diesem Kapitel nun durch.; GetNextModule
Ich habe alle Lektionen durchgearbeitet und bin nun fertig.; GetNextModule
Ich habe nun alle Kapitel und Themen des Moduls abgeschlossen.; GetNextModule
Ich habe alle Aufgaben und Lernziele in diesem Modul erreicht.; GetNextModule
Ich habe alle notwendigen Schritte in diesem Modul absolviert.; GetNextModule
Ich habe alle Fragen in diesem Modul vollständig beantwortet.; GetNextModule
Ich habe alle nötigen Anforderungen des Moduls erfüllt.; GetNextModule
Ich habe das Modul vollständig bearbeitet.; GetNextModule
Ich habe alle Testfragen in diesem Modul korrekt beantwortet.; GetNextModule
Ich habe alle Lerninhalte in diesem Modul erfolgreich absolviert.; GetNextModule
Ich bin mit allen Anforderungen in diesem Modul fertig geworden.; GetNextModule
Ich habe alle Anforderungen des Moduls erfüllt.; GetNextModule
Ich habe alle Aufgaben und Schritte in diesem Modul erfolgreich abgeschlossen.; GetNextModule
Ich bin nun mit der Bearbeitung dieses Moduls fertig.; GetNextModule
Ich bin jetzt fertig.; GetNextModule
Das aktuelle Modul ist für mich nun abgeschlossen.; GetNextModule
Ich habe alle Lernziele und Anforderungen des Moduls erreicht und bin nun abgeschlossen.; GetNextModule
Ich habe alle Abschnitte des Moduls durchgearbeitet und bin nun abgeschlossen.; GetNextModule
Ich habe alle Anforderungen des Moduls vollständig erfüllt und bin nun fertig.; GetNextModule
Ich habe alle Themen in diesem Modul vollständig verinnerlicht.; GetNextModule
Ich habe alle Lektionen des Moduls erfolgreich abgeschlossen.; GetNextModule
Ich habe das Modul vollständig bearbeitet und abgeschlossen.; GetNextModule
Ich habe alle Übungen und Aufgaben des Moduls erfolgreich absolviert und bin nun fertig.; GetNextModule
Ich habe alle erforderlichen Aufgaben und Anforderungen in diesem Modul abgeschlossen.; GetNextModule
Das aktuelle Kapitel wurde von mir erfolgreich abgeschlossen.; GetNextModule
Ich habe alle Aufgaben und Lektionen in diesem Modul durchgearbeitet und bin nun abgeschlossen.; GetNextModule
Ich bin nun bereit für den nächsten Schritt.; GetNextModule
Ich habe alle Lektionen und Aufgaben des Moduls durchgearbeitet.; GetNextModule
Ich habe alle Aufgaben in diesem Modul korrekt gelöst.; GetNextModule
Ich habe alle Themen und Kapitel in diesem Modul abgeschlossen und bin bereit für das nächste.; GetNextModule
Ich habe alle Lektionen und Themen des Moduls durchgearbeitet und bin nun fertig.; GetNextModule
Ich habe alle Lektionen und Herausforderungen in diesem Modul gemeistert und bin nun fertig.; GetNextModule
Ich habe das Modul erfolgreich beendet und bin bereit für das nächste.; GetNextModule
Was wird als nächstes behandelt?; GetNextModuleFrage
Was sind die nächsten Schritte, um meine Kompetenzen zu verbessern?; GetNextModuleFrage
Was sind meine nächsten Lernschritte?; GetNextModuleFrage
Welches Thema sollte ich als Nächstes vertiefen?; GetNextModuleFrage
Welches Thema sollte ich als nächstes angehen?; GetNextModuleFrage
Was sollte ich als Nächstes studieren?; GetNextModuleFrage
Was ist der nächste Schritt, um meine Fähigkeiten zu verbessern?; GetNextModuleFrage
Was ist der nächste Themenblock?; GetNextModuleFrage
Was ist als Nächstes in meinem Lehrplan vorgesehen?; GetNextModuleFrage
Welche Themenbereiche sind als nächstes dran?; GetNextModuleFrage
Welches Thema kommt als Nächstes dran?; GetNextModuleFrage
Was sind die nächsten Schritte im Lernprozess?; GetNextModuleFrage
Was kommt als nächstes dran?; GetNextModuleFrage
Was kann ich als nächstes lernen?; GetNextModuleFrage
Was sollte ich als Nächstes lernen, um mein Wissen zu vertiefen?; GetNextModuleFrage
Welches Thema sollte ich als Nächstes bearbeiten?; GetNextModuleFrage
Welches Thema sollte ich als Nächstes untersuchen?; GetNextModuleFrage
Welches Thema steht als nächstes an der Reihe?; GetNextModuleFrage
Welches Kapitel sollte ich als Nächstes lesen?; GetNextModuleFrage
Was sind die nächsten Lernmodule?; GetNextModuleFrage
Wo geht es als nächstes weiter?; GetNextModuleFrage
Welches Modul folgt als nächstes?; GetNextModuleFrage
Was ist der nächste Abschnitt in meinem Lernprozess?; GetNextModuleFrage
Was sind die nächsten Themen, die ich lernen sollte?; GetNextModuleFrage
Welches Thema ist als Nächstes dran?; GetNextModuleFrage
Welches Thema kommt als Nächstes in meinem Studium?; GetNextModuleFrage
Welches Thema soll ich als nächstes angehen?; GetNextModuleFrage
Wo geht es als nächstes weiter im Kurs?; GetNextModuleFrage
Welches Thema kommt als nächstes dran?; GetNextModuleFrage
Welche Lektionen warten als nächstes auf mich?; GetNextModuleFrage
Was gibt es noch zu lernen?; GetNextModuleFrage
Was sind die nächsten Themen?; GetNextModuleFrage
Was ist das nächste Modul in meiner Ausbildung?; GetNextModuleFrage
Was steht als nächstes auf dem Lehrplan?; GetNextModuleFrage
Was sind die nächsten Lernziele?; GetNextModuleFrage
Welche Themen warten auf mich als nächstes?; GetNextModuleFrage
Welches Thema steht als Nächstes an?; GetNextModuleFrage
Wo soll ich als nächstes meine Aufmerksamkeit drauflegen?; GetNextModuleFrage
Was sind die nächsten Module in meiner Ausbildung?; GetNextModuleFrage
Was kommt als nächstes in meinem Lernplan?; GetNextModuleFrage
Was ist als nächstes auf meinem Lernweg geplant?; GetNextModuleFrage
Was ist der nächste Lernabschnitt?; GetNextModuleFrage
Was ist das nächste Modul auf der Agenda?; GetNextModuleFrage
Was ist die nächste Lektion auf meiner Lernliste?; GetNextModuleFrage
Was ist das nächste Modul auf dem Programm?; GetNextModuleFrage
Welche Themen folgen auf dieses Modul?; GetNextModuleFrage
Welches Thema sollte ich als Nächstes meistern?; GetNextModuleFrage
Was ist als nächstes in meinem Curriculum geplant?; GetNextModuleFrage
Welche Themen sind für mich als nächstes relevant?; GetNextModuleFrage
Welche Inhalte warten als nächstes auf mich?; GetNextModuleFrage
Was sollte ich als Nächstes in Angriff nehmen?; GetNextModuleFrage
Welches Thema ist als nächstes fällig?; GetNextModuleFrage
Welches Wissen steht als nächstes an?; GetNextModuleFrage
Welche Module kommen als nächstes?; GetNextModuleFrage
Was steht als nächstes auf meiner Lernagenda?; GetNextModuleFrage
Welche Inhalte kommen als nächstes?; GetNextModuleFrage
Was sollte ich als Nächstes auf meiner Lernreise lernen?; GetNextModuleFrage
Welche Inhalte sind als nächstes geplant?; GetNextModuleFrage
Was ist der nächste Schritt in meiner Lernreise?; GetNextModuleFrage
Welche Schwerpunkte sind als nächstes dran?; GetNextModuleFrage
Was wäre als Nächstes auf meiner Lernliste?; GetNextModuleFrage
Was sind die nächsten Schritte in meinem Lernprozess?; GetNextModuleFrage
Welches Wissen muss ich als nächstes erwerben?; GetNextModuleFrage
Was sollte ich als Nächstes erforschen?; GetNextModuleFrage
Wie viele Themen muss ich noch lernen?; GetProgress
Wie viele Module sind noch übrig?; GetProgress
Wie viele Lektionen müssen noch gelernt werden?; GetProgress
Wie viele Lerninhalte muss ich noch durchgehen?; GetProgress
Wie viele Themen muss ich noch durchgehen, bevor ich den Kurs beenden kann?; GetProgress
Wie viele Kapitel muss ich noch lernen?; GetProgress
Wie viele Kapitel muss ich noch durchgehen?; GetProgress
Wie viele Einheiten gibt es noch zu bearbeiten?; GetProgress
Wie viele Lerneinheiten muss ich noch durchgehen?; GetProgress
Wie viele Module muss ich noch durchlaufen, bevor der Kurs abgeschlossen ist?; GetProgress
Wie viele Lektionen gibt es insgesamt in diesem Kurs?; GetProgress
Kannst du mir sagen, wie viele Kapitel ich noch lesen muss?; GetProgress
Wie viele Themen habe ich bereits gelernt?; GetProgress
Wie viele Lektionen beinhaltet der Kurs?; GetProgress
Wie viele Kurseinheiten muss ich noch bearbeiten?; GetProgress
Wie viele Abschnitte beinhaltet das Programm?; GetProgress
Wie viele Lernstufen gibt es noch?; GetProgress
Gibt es noch weitere Themen, die ich durchgehen muss?; GetProgress
Gibt es noch weitere Module, die ich durchlaufen muss?; GetProgress
Wie viele Kapitel sind noch zu absolvieren?; GetProgress
Wie viele Lektionen sind noch übrig?; GetProgress
Wie viele Lerninhalte sind noch zu bearbeiten?; GetProgress
Wie viele Lerninhalte muss ich noch absolvieren, bevor der Kurs abgeschlossen ist?; GetProgress
Wie viele Themenblöcke muss ich noch durchgehen?; GetProgress
Wie viele Schritte sind noch zu durchlaufen?; GetProgress
Wie viele Kapitel muss ich noch lernen?; GetProgress
Wie viele Lernmodule gibt es noch zu bearbeiten?; GetProgress
Wie viele Kurseinheiten muss ich noch absolvieren?; GetProgress
Wie viele Einheiten habe ich bereits absolviert und wie viele sind noch übrig?; GetProgress
Kannst du mir sagen, wie viele Module ich noch durchgehen muss?; GetProgress
Wie viele Schritte fehlen noch bis zum Ende?; GetProgress
Wie viele Einheiten muss ich noch abschließen?; GetProgress
Wie viele Abschnitte muss ich noch absolvieren?; GetProgress
Wie weit bin ich in dem Kurs fortgeschritten?; GetProgress
Gibt es noch weitere Einheiten, die ich durchlaufen muss?; GetProgress
Wie viele Abschnitte gibt es in diesem Kurs?; GetProgress
Wie viele Einheiten sind noch übrig?; GetProgress
Wie viele Lektionen habe ich noch zu absolvieren?; GetProgress
Wie viele Teile hat der Kurs?; GetProgress
Kannst du mir sagen, wie viele Lernmodule noch vor mir liegen?; GetProgress
Wie viele Lerninhalte gibt es insgesamt in diesem Kurs?; GetProgress
Wie viele Abschnitte sind noch übrig?; GetProgress
Wie viele Themenbereiche gibt es insgesamt?; GetProgress
Wie viele Module habe ich bereits absolviert und wie viele sind noch übrig?; GetProgress
Gibt es eine Übersicht der Lerneinheiten?; GetProgress
Wie viele Abschnitte sind noch zu durchlaufen?; GetProgress
Wie viele Themen muss ich noch durchgehen?; GetProgress
Wie viele Einheiten habe ich noch nicht abgeschlossen?; GetProgress
Wie viele Abschnitte muss ich noch durchgehen?; GetProgress
Wie viele Kapitel habe ich bereits durchgelesen?; GetProgress
Wie viele Module gibt es insgesamt?; GetProgress
Wie viele Lernmodule sind noch übrig?; GetProgress
Wie viele Lerninhalte warten noch auf mich?; GetProgress
Wie viele Kapitel umfasst das Curriculum?; GetProgress
Wie viele Lektionen muss ich noch durchgehen, bevor ich den Kurs abschließen kann?; GetProgress
Wie viele Lernschritte fehlen noch bis zum Abschluss?; GetProgress
Wie viele Kapitel muss ich noch bewältigen?; GetProgress
Wie viele Themen gibt es noch zu bewältigen?; GetProgress
Wie viele Einheiten sind noch zu absolvieren?; GetProgress
Wie viele Schritte sind noch zu absolvieren?; GetProgress
Wie viele Einheiten habe ich noch nicht abgeschlossen?; GetProgress
Wie viele Teile muss ich noch absolvieren?; GetProgress
Wie viele Kapitel gibt es insgesamt?; GetProgress
Wie viele Module gibt es noch zu durchlaufen?; GetProgress
Hallo; Greet
Wie kann ich dir helfen?; Greet
Hallo und schön, dass du da bist!; Greet
Grüß Gott!; Greet
Willkommen zurück!; Greet
Hallo, wie kann ich dir helfen?; Greet
Hi!; Greet
Wie geht's deinem Lernfortschritt?; Greet
Wie geht es dir heute?; Greet
Was gibt es zu berichten?; Greet
Wie kann ich dir helfen?; Greet
Was gibt es Neues bei dir?; Greet
Schön, dich hier zu haben!; Greet
Hi da!; Greet
Schön, dass du hier bist, wie kann ich dir helfen?; Greet
Wie kann ich dir helfen, deine Ziele zu erreichen?; Greet
Wie läuft's?; Greet
Wie kann ich dich heute unterstützen?; Greet
Schön, dich zu sehen!; Greet
Moin!; Greet
Hi, was kann ich für dich tun?; Greet
Was steht auf dem Programm?; Greet
Hey, wie geht's dir heute?; Greet
Was steht auf deiner To-do-Liste?; Greet
Was hast du vor?; Greet
Hallo, wie geht es dir heute?; Greet
Wie kann ich heute helfen?; Greet
Hallo da!; Greet
Schön, dass du da bist!; Greet
Schön, dich zu sehen!; Greet
Was hast du vor?; Greet
Guten Morgen!; Greet
Hey, wie geht's?; Greet
Wie geht's heute?; Greet
Wie war dein Tag bisher?; Greet
Servus!; Greet
Hallo, wie war dein Tag?; Greet
Wie geht's, wie steht's?; Greet
Was gibt's Neues?; Greet
Hallo, wie kann ich dir weiterhelfen?; Greet
Guten Tag und herzlich willkommen!; Greet
Schön, dich kennenzulernen!; Greet
Schön, dich wiederzusehen!; Greet
Was gibt es Neues bei dir?; Greet
Willkommen!; Greet
Moin!; Greet
Guten Tag!; Greet
Freut mich, mit dir zu sprechen!; Greet
Was hast du geplant?; Greet
Wie geht's im Lernprogramm voran?; Greet
Na, wie läuft's?; Greet
Hey!; Greet
Wie kann ich dich auf deiner Lernreise unterstützen?; Greet
Wie kann ich dir helfen, Fortschritte zu machen?; Greet
Wie kann ich dich in deinem Lernprozess unterstützen?; Greet
Aloha!; Greet
Hey!; Greet
Wie geht es dir heute im Lernprogramm?; Greet
Guten Abend!; Greet
Wie kann ich dich heute unterstützen?; Greet
Guten Tag!; Greet
Hallo, wie geht's dir?; Greet
Was kann ich heute für dich tun?; Greet
Willkommen zurück, wie kann ich dir helfen?; Greet
Hallo und willkommen zurück!; Greet
Hey, was hast du heute gemacht?; Greet
Guten Abend!; Greet
Na, alles klar?; Greet
Was gibt's Neues?; Greet
Hallo!; Greet
Was steht auf deinem Plan?; Greet
Hallo und willkommen zu unserem Lernprogramm!; Greet
Hey, wie geht's?; Greet
Wie kann ich dir heute helfen, Fortschritte zu machen?; Greet
Hey, schön dich zu treffen!; Greet
Hi!; Greet
Wie kann ich dir bei deiner Lernreise helfen?; Greet
Wie kann ich dir bei deinem nächsten Schritt helfen?; Greet
Grüß dich!; Greet
Wie geht's dir?; Greet
Habe Schwierigkeiten, kannst du mich unterstützen?; Help
Benötige Hilfe bei meinem Problem.; Help
Kannst du mir zur Seite stehen?; Help
Kannst du mir helfen, eine bestimmte Aufgabe zu erledigen?; Help
Wie weit reichen deine Fähigkeiten?; Help
Was hast du zu bieten?; Help
Was kannst du mir bieten?; Help
Wie kann ich dich nutzen?; Help
Benötige deinen Input und Rat.; Help
Wäre toll, wenn du mich unterstützen könntest.; Help
Benötige deinen Beistand.; Help
Kannst du mir bei etwas helfen?; Help
Welche Funktionen hast du?; Help
Kannst du mir Lösungen bieten?; Help
Was kann ich mit dir machen?; Help
Kannst du mir bei etwas helfen?; Help
Wie funktionierst du?; Help
Wie kann ich dich programmieren?; Help
Kannst du mir sagen, was du machen kannst?; Help
Wäre nett, wenn du mir helfen könntest.; Help
Brauche Hilfe bei dieser Aufgabe.; Help
Kannst du mich beraten und unterstützen?; Help
Ich stecke fest, kannst du helfen?; Help
Kannst du mich beraten?; Help
Wie kann ich dich anweisen?; Help
Brauche Unterstützung!; Help
Bin auf Hilfe angewiesen.; Help
Was für eine Art von Aufgaben kannst du bewältigen?; Help
Brauche Anleitung, kannst du helfen?; Help
Kannst du mir dabei helfen, etwas zu tun?; Help
Was sind deine besonderen Fähigkeiten?; Help
Brauche deine Expertise, kannst du helfen?; Help
Kannst du mich unterstützen?; Help
Wie kann ich dich konfigurieren?; Help
Brauche deinen Input.; Help
Welche Funktionen stehen mir zur Verfügung?; Help
Wäre toll, wenn du mir helfen könntest.; Help
Kannst du mir helfen?; Help
Kannst du mich coachen?; Help
Was sind deine Fähigkeiten?; Help
Was sind deine Möglichkeiten?; Help
Ich könnte eine Hand gebrauchen.; Help
Kannst du mir weiterhelfen?; Help
Welche Anweisungen verstehst du?; Help
Kannst du mir Tipps geben?; Help
Kannst du mir sagen, was du alles kannst?; Help
Welche Aufgaben kannst du erledigen?; Help
Was kann ich tun?; Help
Wäre dankbar für deine Hilfe und Unterstützung.; Help
Wie arbeitest du?; Help
Wie kann ich deine Fähigkeiten nutzen?; Help
Wie kann ich dich einsetzen?; Help
Kannst du mir helfen?; Help
Wie kann ich dich steuern?; Help
Brauche Rat und Beistand.; Help
Welche Funktionen stehen mir zur Verfügung?; Help
Kannst du mich unterstützen?; Help
Kannst du mir eine Lösung präsentieren?; Help
Was kannst du für mich tun?; Help
Benötige deinen Rat und deine Hilfe.; Help
Benötige Hilfe hier!; Help
Was sind deine Eigenschaften?; Help
Habe eine Herausforderung, kannst du helfen?; Help
Wäre dankbar für deine Hilfe.; Help
Kannst du mir Orientierung geben?; Help
Ich möchte in drei Monaten alle Module des Kurses durchgearbeitet haben.; InformCompletionGoal
Mein Ziel ist es, in drei Monaten den Kurs erfolgreich abzuschließen und meine Kenntnisse zu erweitern.; InformCompletionGoal
Ich möchte innerhalb von drei Monaten mit dem Kurs durchkommen.; InformCompletionGoal
Ich plane, den Kurs in drei Monaten zu beenden.; InformCompletionGoal
In drei Monaten möchte ich den Kurs beendet haben.; InformCompletionGoal
Ich möchte den Kurs in drei Monaten durchlaufen haben.; InformCompletionGoal
Ich will in drei Monaten fertig sein.; InformCompletionGoal
Innerhalb der nächsten drei Monate möchte ich den Kurs abschließen.; InformCompletionGoal
Ich habe vor, innerhalb von drei Monaten den Kurs erfolgreich abzuschließen.; InformCompletionGoal
Ich plane, den Kurs in drei Monaten zu beenden und zertifiziert zu werden.; InformCompletionGoal
Ich strebe an, in drei Monaten den Kurs erfolgreich beendet zu haben.; InformCompletionGoal
Meine Zielvorgabe lautet, in drei Monaten mit dem Kurs durchzukommen.; InformCompletionGoal
Mein Ziel ist es, in drei Monaten alle Lerninhalte des Kurses abzuschließen.; InformCompletionGoal
In drei Monaten möchte ich das Zertifikat für den Kurs in den Händen halten.; InformCompletionGoal
In drei Monaten möchte ich den Kurs abgeschlossen haben.; InformCompletionGoal
Mein Ziel ist es, innerhalb von drei Monaten mit dem Kurs fertig zu werden.; InformCompletionGoal
Mein Ziel ist es, innerhalb von drei Monaten den Kurs zu beenden.; InformCompletionGoal
In drei Monaten möchte ich den Kurs erfolgreich durchlaufen haben.; InformCompletionGoal
Mein Ziel ist es, in drei Monaten den Kurs erfolgreich zu beenden.; InformCompletionGoal
Ich will den Kurs in drei Monaten abgeschlossen haben.; InformCompletionGoal
Ich strebe danach, in drei Monaten den Kurs erfolgreich abzuschließen.; InformCompletionGoal
