"Was Neues lernen",
"Woanders weitermachen",
"Andere Inhalte",
"Neues anfangen",
"Mit dem nächsten Thema beginnen",
"Was gibt es noch?"
"Was sind meine weiteren Lernmöglichkeiten?",
"Welche weiteren Lernmaterialien gibt es?",
"Gibt es noch andere Themen?",
"Welche anderen Themenbereiche gibt es?",
"Welche anderen Themen sind noch relevant für meine Ausbildung?",
"Welche anderen Themen gibt es noch?",
"Kann ich weitere Lernmöglichkeiten nutzen?",
"Gibt es noch weitere Lerneinheiten?",
"Kannst du mir andere Lerninhalte empfehlen?",
"Gibt es andere Lernmodule, die ich angehen kann?",
"Was sind meine Alternativen für das nächste Modul?",
"Welche anderen Einheiten gibt es noch?",
"Was sind meine alternativen Lernmöglichkeiten?",
"Welche weiteren Lernquellen stehen zur Verfügung?",
"Welche anderen Module stehen zur Verfügung?",
"Welche weiteren Themen und Module sind für mich relevant?",
"Welche anderen Themen sind noch relevant?",
"Was kann ich noch tun?",
"Was gibt es noch, was ich erforschen kann?",
"Was gibt es noch, um mein Wissen zu erweitern?",
"Welche anderen Themen stehen zur Verfügung?",
"Welche anderen Inhalte gibt es?",
"Gibt es noch andere Themen, die für mich relevant sind?",
"Was ist der nächste Bereich, den ich erforschen kann?",
"Was gibt es noch, was ich lernen kann?",
"Was gibt es noch zu lernen?",
"Welche weiteren Möglichkeiten stehen mir zur Verfügung?",
"Welche Inhalte stehen mir noch zur Verfügung?",
"Kannst du mir weitere Lerninhalte zur Verfügung stellen?",
"Was kann ich sonst noch lernen, um meine Fähigkeiten zu verbessern?",
"Welche weiteren Lerninhalte sind für mich verfügbar?",
"Welche Optionen habe ich für mein Lernprogramm?",
"Welche Themen sind noch offen?",
"Gibt es noch andere Module, die ich absolvieren kann?",
"Welche anderen Themen können mir helfen, meine Ziele zu erreichen?",
"Welche anderen Themen sind in meinem Lernprogramm enthalten?",
"Welche anderen Kapitel kann ich studieren?",
"Was kann ich sonst noch machen?",
"Welche weiteren Themen stehen zur Verfügung?",
"Was sind meine Optionen für weitere Lerninhalte?",
"Gibt es andere Module, die mich interessieren könnten?",
"Was sind meine anderen Möglichkeiten, um mehr zu lernen?",
"Was sind meine Alternativen?",
"Was sind meine Möglichkeiten, um weiterzulernen?",
"Gibt es weitere Themen, die ich erkunden kann?",
"Was sind die anderen verfügbaren Lernressourcen?",
"Gibt es andere Module, die für mich geeignet sind?",
"Welche anderen Themenbereiche kann ich erkunden?",
"Gibt es andere Module, die mich herausfordern könnten?",
"andere",
"Alternativen",
"neues"