"Wo kann ich Infos zum Thema [Mask] finden?",
"Wo kann ich erfahren, wie man [Mask] durchführt?",
"Wo kann ich spezifische Anwendungen von [Mask] finden?",
"Wo kann ich Beispiele für [Mask] finden?",
"Wo kann ich Ressourcen über [Mask] finden?",
"Wo kann ich mehr über [Mask] lernen?",
"Wo kann ich Bücher über [Mask] finden?",
"Wo kann ich Grundlagen von [Mask] finden?",
"Wo kann ich Tutorials zu [Mask] finden?",
"Wo kann ich eine Einführung in [Mask] finden?",
"Wo kann ich Beispiele für [Mask] finden?",
"Wo kann ich mehr über [Mask] erfahren?",
"Wo kann ich eine einfache Erklärung für den Begriff [Mask] finden?",
"Wo finde ich Übungen zu [Mask]?",
"Wo finde ich Infos zu [Mask]?",
"Wo finde ich die Grundlagen von [Mask]?",
"Wo finde ich Artikel über [Mask]?",
"Wo finde ich Informationen über [Mask]?",
"Wo finde ich Videos, die [Mask] erklären?",
"Wo finde ich Bücher oder Artikel über [Mask]?",
"Wo finde ich Lernmaterialien zu [Mask]?",
"Wo steht was zu [Mask]?",
"Zeig mir Inhalte zu [Mask]",
"Wie führt man [Mask] durch?",
"Welche Informationsquellen gibt es zur [Mask]?"
"Könntest du mir erklären, was der Begriff [Mask] bedeutet?",
"Könntest du mir erklären, was [Mask] bedeutet?",
"Könntest du mir eine einfache Erklärung von [Mask] geben?",
"Könntest du mir eine kurze Erklärung für den Begriff [Mask] geben?",
"Kannst du mir eine Definition von [Mask] geben?",
"Kannst du mir eine kurze Beschreibung von [Mask] geben?",
"Kannst du mir eine präzise Erklärung geben, was mit [Mask] gemeint ist?",
"Ich verstehe den Begriff [Mask] nicht. Kannst du ihn erklären?",
"Was ist das Ziel der [Mask] und wie wird es erreicht?",
"Was ist die Bedeutung von [Mask]?",
"Was ist mit [Mask] gemeint?",
"Was ist [Mask]?",
"Was ist die Definition von [Mask]?",
"Was sind die grundlegenden Konzepte hinter der [Mask]?",
"Was bezeichnet man als [Mask]?",
"suchen",
"finden",
"Definition",
"Bedeutung",
"erklären"