"Wo kann ich Infos zum Thema [MASK] finden?",
"Wo kann ich erfahren, wie man [MASK] durchführt?",
"Wo kann ich spezifische Anwendungen von [MASK] finden?",
"Wo kann ich Beispiele für [MASK] finden?",
"Wo kann ich Ressourcen über [MASK] finden?",
"Wo kann ich mehr über [MASK] lernen?",
"Wo kann ich Bücher über [MASK] finden?",
"Wo kann ich Grundlagen von [MASK] finden?",
"Wo kann ich Tutorials zu [MASK] finden?",
"Wo kann ich eine Einführung in [MASK] finden?",
"Wo kann ich Beispiele für [MASK] finden?",
"Wo kann ich mehr über [MASK] erfahren?",
"Wo kann ich eine einfache Erklärung für den Begriff [MASK] finden?",
"Wo finde ich Übungen zu [MASK]?",
"Wo finde ich Infos zu [MASK]?",
"Wo finde ich die Grundlagen von [MASK]?",
"Wo finde ich Artikel über [MASK]?",
"Wo finde ich Informationen über [MASK]?",
"Wo finde ich Videos, die [MASK] erklären?",
"Wo finde ich Bücher oder Artikel über [MASK]?",
"Wo finde ich Lernmaterialien zu [MASK]?",
"Wo steht was zu [MASK]?",
"Zeig mir Inhalte zu [MASK]",
"Wie führt man [MASK] durch?",
"Welche Informationsquellen gibt es zur [MASK]?"
"Könntest du mir erklären, was der Begriff [MASK] bedeutet?",
"Könntest du mir erklären, was [MASK] bedeutet?",
"Könntest du mir eine einfache Erklärung von [MASK] geben?",
"Könntest du mir eine kurze Erklärung für den Begriff [MASK] geben?",
"Kannst du mir eine Definition von [MASK] geben?",
"Kannst du mir eine kurze Beschreibung von [MASK] geben?",
"Kannst du mir eine präzise Erklärung geben, was mit [MASK] gemeint ist?",
"Ich verstehe den Begriff [MASK] nicht. Kannst du ihn erklären?",
"Was ist das Ziel der [MASK] und wie wird es erreicht?",
"Was ist die Bedeutung von [MASK]?",
"Was ist mit [MASK] gemeint?",
"Was ist [MASK]?",
"Was ist die Definition von [MASK]?",
"Was sind die grundlegenden Konzepte hinter der [MASK]?",
"Was bezeichnet man als [MASK]?",
"suchen",
"finden",
"Definition",
"Bedeutung",
"erklären"